{
  "$schema": "https://json-schema.org/draft/2020-12/schema",
  "$id": "https://hypertest.dev/schemas/profile.v1.schema.json",
  "title": "HyperTest Profile v1",
  "type": "object",
  "additionalProperties": true,
  "required": [
    "schema",
    "name",
    "runtime",
    "sut",
    "adapters",
    "gate",
    "workspace"
  ],
  "properties": {
    "schema": {
      "const": "hypertest.profile/v1"
    },
    "name": {
      "type": "string",
      "minLength": 1
    },
    "runtime": {
      "type": "object",
      "additionalProperties": false,
      "required": [
        "provider"
      ],
      "properties": {
        "provider": {
          "enum": [
            "deterministic",
            "openai-compatible"
          ]
        },
        "model": {
          "type": "string",
          "minLength": 1
        },
        "budgets": {
          "type": "object",
          "additionalProperties": false,
          "properties": {
            "maxTurns": { "type": "integer", "minimum": 1 },
            "maxToolCalls": { "type": "integer", "minimum": 1 },
            "maxRepairRounds": { "type": "integer", "minimum": 0, "maximum": 2 },
            "wallClockMs": { "type": "integer", "minimum": 1 },
            "tokenBudget": { "type": "integer", "minimum": 1 }
          }
        },
        "baseUrl": {
          "type": "string",
          "minLength": 1
        },
        "timeoutMs": {
          "type": "integer",
          "minimum": 100,
          "maximum": 600000
        },
        "maxRetries": {
          "type": "integer",
          "minimum": 0,
          "maximum": 10
        },
        "maxOutputTokens": {
          "type": "integer",
          "minimum": 1,
          "maximum": 131072
        },
        "maxTurns": { "type": "integer", "minimum": 1 },
        "maxToolCalls": { "type": "integer", "minimum": 1 },
        "maxRepairRounds": { "type": "integer", "minimum": 0, "maximum": 2 },
        "wallClockMs": { "type": "integer", "minimum": 1 },
        "tokenBudget": { "type": "integer", "minimum": 1 },
        "max_repair_rounds": {
          "type": "integer",
          "minimum": 0,
          "maximum": 2
        }
      }
    },
    "sut": {
      "type": "object",
      "required": [
        "contractSource",
        "sourceKind"
      ],
      "properties": {
        "contractSource": {
          "type": "string"
        },
        "sourceKind": {
          "type": "string"
        }
      }
    },
    "adapters": {
      "type": "object",
      "required": [
        "sut",
        "test"
      ],
      "properties": {}
    },
    "gate": {
      "type": "object",
      "required": [
        "mode"
      ],
      "properties": {
        "mode": {
          "enum": [
            "static-allow",
            "static-deny",
            "process"
          ]
        },
        "process": {
          "type": "object"
        }
      }
    },
    "workspace": {
      "type": "object",
      "required": [
        "allowedWriteGlobs",
        "forbiddenGlobs"
      ],
      "properties": {
        "allowedWriteGlobs": {
          "type": "array",
          "items": {
            "type": "string"
          }
        },
        "forbiddenGlobs": {
          "type": "array",
          "items": {
            "type": "string"
          }
        }
      }
    },
    "options": {
      "type": "object"
    }
  }
}
